﻿msg_0,"[color(yellow)]散歩してる女性[color(white)]
最近、ＪＯＫＥＲ事件ばかり続いて、本当に嫌ね。
だんだん残虐な殺し方になってるみたいだし、
きっと愉快犯なのよ。[wait][clear][color(yellow)]散歩してる女性[color(white)]
人殺しにいいも悪いもないけど、
マスコミが取り上げてから酷くなった気がするわ。
騒ぎ過ぎるのも考え物よね。[wait][clear][end]"
msg_74,"[color(yellow)]散歩してる女性[color(white)]
時間城でカードの複製をしてくれるって
聞いたけど、それってどういう仕組みなの？
なんか納得できないわね。[wait][clear][end]"
msg_75,"[color(yellow)]散歩してる女性[color(white)]
時間城で魔法のカードを売ってるって聞いたのよ。
…変じゃない？[wait][clear][color(yellow)]散歩してる女性[color(white)]
だって、いきなり魔法とかいわれても、
実際あるものなのかな？[wait][clear][end]"
msg_76,"[color(yellow)]中年サラリーマン[color(white)]
またＪＯＫＥＲ事件ですか…
いやな世の中ですねぇ。[wait][clear][color(yellow)]中年サラリーマン[color(white)]
初めのころに比べると、事件が複雑で、
残酷になったように思うんですよ。
まるで犯人が変化したみたいですね。[wait][clear][end]"
msg_77,"[color(yellow)]中年サラリーマン[color(white)]
セブンスの紋章がＪＯＫＥＲ除けに
効果があるとは…[wait][clear][color(yellow)]中年サラリーマン[color(white)]
ちょっとオカルトめいた話だが、
最近は噂もバカにできませんしね。
私も１つ手に入れてみる事にしますよ。[wait][clear][end]"
msg_78,"[color(yellow)]中年サラリーマン[color(white)]
そういえば、１０年ほど前にも
連続殺人事件がありましてね。
その時も結局犯人が捕まらなかったんですよ。[wait][clear][color(yellow)]中年サラリーマン[color(white)]
今度はなんとか捕まえて、
無事に一件落着してほしいですね。[wait][clear][end]"
msg_79,"[color(yellow)]中年サラリーマン[color(white)]
空の科学館が火事で消失したそうだね。
あそこは子供たちが大好きだったのに…
なんとも残念な事だ。
[wait][clear][end]"
msg_80,"[color(yellow)]中年サラリーマン[color(white)]
ワンロン千鶴の番組を見ましたか？
まさかサイコホラーの世界が
現実になるなんて思いませんでしたよ。[wait][clear][color(yellow)]中年サラリーマン[color(white)]
にわかには信じがたいですが、
でもこれだけ変な事が続いてると、
あり得ないとは言い切れないですね。[wait][clear][end]"
msg_81,"[color(yellow)]中年サラリーマン[color(white)]
最近は昨日の常識が通用しない事ばかりですね。
警察も一向に当てにならないし、
自分達でなんとかするしかないのかな。[wait][clear][end]"
msg_82,"[color(yellow)]中年サラリーマン[color(white)]
私もついにＪＯＫＥＲを目撃しましたよ。
と、いってもすぐに黒ずくめの男たちが
連れ去っていったんですけどね。[wait][clear][color(yellow)]中年サラリーマン[color(white)]
もうぼやぼやとはしていられないなあ。[delay(15)]
最近、武器なんかを売っている店も
あるみたいだし、私も備えとかないと。[wait][clear][end]"
msg_83,"[color(yellow)]中年サラリーマン[color(white)]
いや急な話だけど事件が解決するかもしれないね。
なんでも、重要な情報を握っている人物が
いるらしいんだ。[wait][clear][color(yellow)]中年サラリーマン[color(white)]
いまは、街中その話題で持ちきりさ。
とにかく、私は良いように進展がある事を願うよ。[wait][clear][end]"
msg_84,"[color(yellow)]中年サラリーマン[color(white)]
あ、あなたは南条グループの…
ウチの会社がいつもお世話になっております。[wait][clear][end]"
msg_85,"[color(yellow)]南条[color(white)]
失礼ですが…[delay(15)]
どこかでお会いしましたか？[wait][clear][end]"
msg_86,"[color(yellow)]中年サラリーマン[color(white)]
いえ、私のような課長風情では…
ただ、うちの商品の８割は、デパート南条屋で
扱っていただいているんです。[wait][clear][color(yellow)]中年サラリーマン[color(white)]
それで、一度お顔を拝見したことがございまして。
わたくし、こういう者でございます。[wait][clear][end]"
msg_87,"[color(yellow)]南条[color(white)]
東日本紡績…ああ、繊維メーカーの方ですか。[delay(10)]
部下から品質が良いメーカーと聞いております。
これからもお願いしますよ。では。[wait][clear][end]"
msg_88,"[color(yellow)]うらら[color(white)]
うわ……
なんかアタシらとは無縁な世界の会話だわ。[wait][clear][end]"
msg_89,"[color(yellow)]南条[color(white)]
これも南条家の人間の務めですから。
さ、行きましょうか。[wait][clear][end]"
msg_90,"[color(yellow)]中年サラリーマン[color(white)]
あ、南条様、[delay(15)]
いつもお世話になっております。[wait][clear][end]"
msg_91,"[color(yellow)]中年サラリーマン[color(white)]
噂の人物は現れたけれど、
すぐ姿をくらませたそうですね。[wait][clear][color(yellow)]中年サラリーマン[color(white)]
事件解決の糸口になるかと期待していたんですが、
やはり、そう甘くは無いですねぇ。[wait][clear][end]"
msg_92,"[color(yellow)]中年サラリーマン[color(white)]
近ごろ講演会が大はやりで、
みんな影響をうけてるみたいですね。
私は興味は無いんですが。[wait][clear][color(yellow)]中年サラリーマン[color(white)]
人間誰しも悪い部分を持っています。
それに目を背けたらいけない気がするんですよ。
はは。カッコつけ過ぎですかね。[wait][clear][end]"
msg_93,"[color(yellow)]中年サラリーマン[color(white)]
あ、南条様。
よく会いますね。
え？なにか変わった事ですか？[wait][clear][color(yellow)]中年サラリーマン[color(white)]
そういえば、講演会がよく話題に上ってますね。
スマイル平坂で、音楽プロデューサーの佐々木氏が、
講演を開くとか聞きましたよ。[wait][clear][end]"
msg_94,"[color(yellow)]中年サラリーマン[color(white)]
最近、頭の中の記憶がこんがらがるんです。
そんなつもりは無いんですが、
働き過ぎでしょうか…[wait][clear][end]"
msg_95,"[color(yellow)]中年サラリーマン[color(white)]
ニュースでやるくらいなんだから、
デタラメでは無いんでしょうが、
にわかには信じられませんね。[wait][clear][color(yellow)]中年サラリーマン[color(white)]
すべての事件が新世塾という組織のしわざで、
しかも世界の滅亡を狙っているなんて。
そいつら、どうかしてますよ。[wait][clear][end]"
msg_96,"[color(yellow)]中年サラリーマン[color(white)]
あ、これは南条様。[wait][clear][color(yellow)]中年サラリーマン[color(white)]
ニュースで新世塾という組織が一連の事件を起こし
世界の破滅を狙っていると聞いたのですが、
すべて本当のことなんでしょうか？[wait][clear][color(yellow)]中年サラリーマン[color(white)]
何かご存じありませんかね？[wait][clear][end]"
msg_97,"[color(yellow)]南条[color(white)]
いや…その件に関しては何とも…[wait][clear][end]"
msg_98,"[color(yellow)]中年サラリーマン[color(white)]
い、いや、何か関係があると
思っての事では無いんです。
ただ不安で。[wait][clear][color(yellow)]中年サラリーマン[color(white)]
貴方ほどの方なら、何か知っていると
思ったのですが…
いや、大変失礼しました。[wait][clear][end]"
msg_99,"[color(yellow)]中年サラリーマン[color(white)]
ついに天変地異ですか。
もうここまできたら、世界が破滅に
向かっていることは疑いの余地がないですね。[wait][clear][color(yellow)]中年サラリーマン[color(white)]
我々にできることはないのでしょうか…[wait][clear][end]"
msg_100,"[color(yellow)]中年サラリーマン[color(white)]
地下鉄工事現場で遺跡が見つかった話は
もう聞きましたか？[wait][clear][color(yellow)]中年サラリーマン[color(white)]
テレビの速報で流れてたものですから、
町じゅうその話で持ちきりですよ。
とはいえ話すだけでどうしようもないんですが。[wait][clear][color(yellow)]中年サラリーマン[color(white)]
このままだと、世界は新世塾の思うがままですね。
何とかする方法は無いんでしょうか…[wait][clear][end]"
msg_101,"[color(yellow)]中年サラリーマン[color(white)]
こんなことが現実になるなんて…
これまでの私の…いや、みんなの人生は
無意味だったんでしょうか？[wait][clear][end]"
msg_102,"[color(yellow)]中年サラリーマン[color(white)]
なんだか想像を越えた事態になってしまって、
かえって吹っ切れましたよ。[wait][clear][color(yellow)]中年サラリーマン[color(white)]
とにかく、あきらめない事にしました。
といって、何をするわけでもないですが、
悲観的になっても仕方ないですからね。[wait][clear][end]"
msg_103,"[color(yellow)]中年サラリーマン[color(white)]
なんでもクラブゾディアックは店内を
ダンジョンに改造しているというんですよ。[wait][clear][color(yellow)]中年サラリーマン[color(white)]
確かに奇抜な趣向ですが、お客さんが
迷ったりしないんでしょうか？[wait][clear][end]"
msg_104,"[color(yellow)]中年サラリーマン[color(white)]
随分薄気味悪い城が出てきましたね。
聞いた話だと、あの城の昔の城主、澄丸清忠は
呪術の生贄に何人もの領民を殺したとか。[wait][clear][color(yellow)]中年サラリーマン[color(white)]
最後は天野舞姫という人に倒されたそうですが、
何やら、その亡霊が世界を破滅に導くようで、
見る度にぞっとしますよ。[wait][clear][end]"
msg_105,"[color(yellow)]中年サラリーマン[color(white)]
昔、[suou]辰之進が澄丸清忠を成敗したのは
恋人の天野舞姫と二人が協力して、
初めてなしえたことだとか。[wait][clear][color(yellow)]中年サラリーマン[color(white)]
しかも、犠牲もまた大きかったようです。
今回もすんなり何事も無く、
とはいかないでしょうね。[wait][clear][end]"
msg_106,"[color(yellow)]中年サラリーマン[color(white)]
随分薄気味悪い城が出てきましたね。
聞いた話だと、あの城の昔の城主、澄丸清忠は
呪術の生贄に何人もの領民を殺したとか。[wait][clear][color(yellow)]中年サラリーマン[color(white)]
最後は[suou]辰之進という侍に倒されたのですが
何やら、その亡霊が世界を破滅に導くようで、
見る度にぞっとしますよ。[wait][clear][end]"
msg_107,"[color(yellow)]中年サラリーマン[color(white)]
昔、天野舞姫が澄丸清忠を成敗したのは
恋人の[suou]辰之進と二人が協力して、
初めてなしえたことだとか。[wait][clear][color(yellow)]中年サラリーマン[color(white)]
しかも、犠牲もまた大きかったようです。
今回もすんなり何事も無く、
とはいかないでしょうね。[wait][clear][end]"
msg_108,"[color(yellow)]中年サラリーマン[color(white)]
つい最近、青葉公園の花が話すという話を
聞きまして…初めは疑ったんですが、
本当らしいんですよ。[wait][clear][color(yellow)]中年サラリーマン[color(white)]
植物と語るなんて、シーボルトも真っ青ですね。
あっはっは。[wait][clear][end]"
msg_109,"[color(yellow)]中年サラリーマン[color(white)]
伝説の武器職人がいると聞いたのですが、
やはり剣を作るんでしょうかね？[wait][clear][color(yellow)]中年サラリーマン[color(white)]
使う気は無いんですが、
刀剣を見るのは好きでしてね。
一度見てみたいものですなぁ。[wait][clear][end]"
msg_110,"[color(yellow)]中年サラリーマン[color(white)]
い、いや、勘弁して下さい。
くだんなんて知りませんよ私は。[wait][clear][end]"
msg_111,"[color(yellow)]中年サラリーマン[color(white)]
１００キロババアを越える２００キロジジイの噂、
ご存じですか？[wait][clear][color(yellow)]中年サラリーマン[color(white)]
ギガ・マッチョに出没しているらしいんですが、
時速２００キロとは、
まさに常識はずれの速さですな。[wait][clear][end]"
msg_112,"[color(yellow)]中年サラリーマン[color(white)]
例の呪いのタクシーの噂はご存じですか？
タクシードライバーの方は大変みたいですよ。
最近、タクシーの数が減りましたからね。[wait][clear][end]"
msg_113,"[color(yellow)]中年サラリーマン[color(white)]
噂に聞く青マントが現れた、と聞いたのですが、
青マントというのは聞いたことがないんですよ。
赤マントならあるんですが。[wait][clear][end]"
msg_114,"[color(yellow)]中年サラリーマン[color(white)]
怪人赤マントが現れたそうですね…
それが、私の知る赤マントなら、次々と美女を
連れ去る危険な奴です。[wait][clear][color(yellow)]中年サラリーマン[color(white)]
ダンスパーティーなどによく現れますから、
あなた達も気をつけて下さい。
まあ、もう１３年も前の話ですが…[wait][clear][end]"
msg_115,"[color(yellow)]中年サラリーマン[color(white)]
ムー大陸にムッシー現る！[delay(15)]
なんて聞いたんですが、今度は恐竜騒動ですかね？
どうせアトラクションとは思うんですが…[wait][clear][color(yellow)]中年サラリーマン[color(white)]
でも、信じられない事が起こるご時世だし、
ホンモノなのかもしれませんね。[wait][clear][end]"
msg_116,"[color(yellow)]中年サラリーマン[color(white)]
ＣＤショップのギガ・マッチョに、
すごいスピードで走り回る１００キロババアという
妖怪が現れたそうですね。[wait][clear][color(yellow)]中年サラリーマン[color(white)]
私もギガ・マッチョはよく利用するので、
ちょっと、怖いんですよ。
何とかならないもんですかねぇ。[wait][clear][end]"
msg_117,"[color(yellow)]中年サラリーマン[color(white)]
カシマレイコが珠閒瑠テレビに取り憑いたそうです。
早くどこかへいってほしいんですが、
家とかにこられると困りますしね…[wait][clear][color(yellow)]中年サラリーマン[color(white)]
けっこう不安ですよ。[wait][clear][end]"
msg_118,"[color(yellow)]中年サラリーマン[color(white)]
ツチノコが見つかったという話を聞きましたか？
子供の時からツチノコ発見の話題が何度か
出たんですが、捕まらずに終わるばかりで…[wait][clear][color(yellow)]中年サラリーマン[color(white)]
マンホール下にかくれている所まで
解っているんですから、
今度はぜひ捕まえてほしいですね。[wait][clear][end]"
msg_119,"[color(yellow)]中年サラリーマン[color(white)]
春日山高校に防空壕跡があるんですよ。
いま、妖怪テケテケで騒ぎが起きていますが、
その中から出てきてるんだと私は思いますね。[wait][clear][end]"
msg_120,"[color(yellow)]中年サラリーマン[color(white)]
これからはファンタジーワールドという雑誌が
流行るらしいですね。[wait][clear][color(yellow)]中年サラリーマン[color(white)]
懸賞で不思議なカードが当たるとかで、
結構盛り上がってますよ。[wait][clear][end]"
msg_121,"[color(yellow)]中年サラリーマン[color(white)]
これからはファンタジーワールドという雑誌が
流行るらしいですね。[wait][clear][color(yellow)]中年サラリーマン[color(white)]
懸賞で特殊なアイテムが当たるとかで、
結構盛り上がってますよ。[wait][clear][end]"
msg_122,"[color(yellow)]中年サラリーマン[color(white)]
これからはファンタジーワールドという雑誌が
流行るらしいですね。[wait][clear][color(yellow)]中年サラリーマン[color(white)]
懸賞で素敵なアクセサリーが当たるとかで、
結構盛り上がってますよ。[wait][clear][end]"
msg_123,"[color(yellow)]中年サラリーマン[color(white)]
これからはファンタジーワールドという雑誌が
流行るらしいですね。[wait][clear][color(yellow)]中年サラリーマン[color(white)]
懸賞で実用的な防具が当たるとかで、
結構盛り上がってますよ。[wait][clear][end]"
msg_124,"[color(yellow)]中年サラリーマン[color(white)]
これからはファンタジーワールドという雑誌が
流行るらしいですね。[wait][clear][color(yellow)]中年サラリーマン[color(white)]
懸賞で本当に使える武器が当たるとかで、
結構盛り上がってますよ。[wait][clear][end]"
msg_125,"[color(yellow)]中年サラリーマン[color(white)]
別冊ミラクルの懸賞が話題なんですが、
ひょっとしてファンタジーブームなんですかね？
仕事柄ちょっと気になるもんで…[wait][clear][color(yellow)]中年サラリーマン[color(white)]
あ、仕事は衣料関係なんですよ。
懸賞の不思議なカード目当てなら
関係ないんですけどね。[wait][clear][end]"
msg_126,"[color(yellow)]中年サラリーマン[color(white)]
別冊ミラクルの懸賞が話題なんですが、
ひょっとしてファンタジーブームなんですかね？
仕事柄ちょっと気になるもんで…[wait][clear][color(yellow)]中年サラリーマン[color(white)]
あ、仕事は衣料関係なんですよ。
懸賞の変わったアイテムが目当てなら
関係ないんですけどね。[wait][clear][end]"
msg_127,"[color(yellow)]中年サラリーマン[color(white)]
月刊バトルマスターなんて、これまでは
マイナー誌だったんですけど、
最近、物騒だから流行りみたいですよ。[wait][clear][color(yellow)]中年サラリーマン[color(white)]
懸賞のアクセサリープレゼントも
大好評みたいだし、
なんだか羨ましいですよね。[wait][clear][end]"
msg_128,"[color(yellow)]中年サラリーマン[color(white)]
月刊バトルマスターなんて、これまでは
マイナー誌だったんですけど、
最近、物騒だから流行りみたいですよ。[wait][clear][color(yellow)]中年サラリーマン[color(white)]
懸賞の護身用防具プレゼントも
大好評みたいだし、
なんだか羨ましいですよね。[wait][clear][end]"
msg_129,"[color(yellow)]中年サラリーマン[color(white)]
月刊バトルマスターなんて、これまでは
マイナー誌だったんですけど、
最近、物騒だから流行りみたいですよ。[wait][clear][color(yellow)]中年サラリーマン[color(white)]
懸賞の強力武器プレゼントも
大好評みたいだし、
なんだか羨ましいですよね。[wait][clear][end]"
msg_130,"[color(yellow)]中年サラリーマン[color(white)]
ホテル・プレアデスのエボニーに、
地図を集めるのが趣味の富豪がいるそうです。
金持ちの道楽ってやつですね。[wait][clear][end]"
msg_131,"[color(yellow)]中年サラリーマン[color(white)]
平坂区のサトミタダシに、
地図を集めるのが趣味の富豪がいるそうです。
道楽家らしいですが、筋金入りの人ですねぇ。[wait][clear][end]"
msg_132,"[color(yellow)]中年サラリーマン[color(white)]
パパラチャという宝石屋も商売熱心ですねぇ！
この騒ぎの中、店を港南区に移転して、
商売を再開したそうですよ！[wait][clear][end]"
msg_133,"[color(yellow)]中年サラリーマン[color(white)]
パパラチャという宝石屋で、武器や防具の
開発をはじめたと聞いたのですが、
やっぱり手に職を持ってる人は強いですな。[wait][clear][color(yellow)]中年サラリーマン[color(white)]
私も何か資格でも取っておけばよかった
と思いますよ。[wait][clear][end]"
msg_134,"[color(yellow)]中年サラリーマン[color(white)]
いやはや、あのギャルソンはただ者じゃないね！
街が空を飛んで大騒ぎになっている最中に、
青葉区に店ごと引っ越してきたんだからね。[wait][clear][color(yellow)]中年サラリーマン[color(white)]
こんな状態でもクレール・ド・リュンヌの料理が
食べられるのは有り難いね。
少しは元気を出さないと。[wait][clear][end]"
msg_135,"[color(yellow)]中年サラリーマン[color(white)]
クレール・ド・リュンヌで防具を売っている
と聞いたんですが、行きつけの店だけに
ビックリしましたよ。[wait][clear][color(yellow)]中年サラリーマン[color(white)]
全然そんな様子は見たこともないですからね。
身近なところに驚きが隠れているもんですなぁ。
あっはっは。[wait][clear][end]"
msg_136,"[color(yellow)]中年サラリーマン[color(white)]
クレール・ド・リュンヌで武器を売っている
と聞いたんですが、行きつけの店だけに
ビックリしましたよ。[wait][clear][color(yellow)]中年サラリーマン[color(white)]
全然そんな様子は見たこともないですからね。
身近なところに驚きが隠れているもんですなぁ。
あっはっは。[wait][clear][end]"
msg_137,"[color(yellow)]中年サラリーマン[color(white)]
珠閒瑠ジニーの相性占い、
占いの幅が広がったそうですね。
仕事の相性もＯＫなら行ってみようかな？[wait][clear][end]"
msg_138,"[color(yellow)]中年サラリーマン[color(white)]
珠閒瑠ジニーの占いは、
ずいぶん当たるそうですね。
凄い評判ですよ。[wait][clear][color(yellow)]中年サラリーマン[color(white)]
相性占いがあるそうですが、企業同士の相性なんて
占ってくれると便利なんですけどね。
あっはっは。[wait][clear][end]"
msg_139,"[color(yellow)]中年サラリーマン[color(white)]
やっぱりワンロン占いは凄いですねぇ。[wait][clear][color(yellow)]中年サラリーマン[color(white)]
当たらない事で有名だった珠閒瑠ジニーが、
ワンロン占いに切り替えた途端に、
よく当たると噂になってるんですよ。[wait][clear][color(yellow)]中年サラリーマン[color(white)]
私も次にどんな洋服の柄が流行るか、
占って貰おうかな。[wait][clear][end]"
msg_140,"[color(yellow)]中年サラリーマン[color(white)]
エステショップ、エテーリアが差別化のために
サービスを変更するそうですよ。
直接関係ないとはいえ、気になりますよね。[wait][clear][end]"
msg_141,"[color(yellow)]中年サラリーマン[color(white)]
ロサカンディータのマヌカンが、
パリで波に飲まれたとか。
パリといえば服の流行の事でしょうが…[wait][clear][color(yellow)]中年サラリーマン[color(white)]
まあ、話半分に聞いていたほうがいいでしょうね。
多分、パリで商品を仕入れた事をショッキングに
伝えたかったんでしょう。[wait][clear][end]"
msg_142,"[color(yellow)]中年サラリーマン[color(white)]
やはりそうでしたか。
しかし、本当に衝撃を受けていたとは…
プロなら世界の流行も押さえておくべきですよね[wait][clear][end]"
msg_143,"[color(yellow)]中年サラリーマン[color(white)]
え…バリの海で高波に飲まれてた？[delay(15)]
私、衣料関係に務めているものでつい服の事かと。
いやはや、これは早とちりでしたね。[wait][clear][end]"
msg_144,"[color(yellow)]中年サラリーマン[color(white)]
ロサカンディータのマヌカンが、
バリの海で高波に飲まれたそうですね。[wait][clear][color(yellow)]中年サラリーマン[color(white)]
やはり海には気をつけないと。
旅先では気が緩みがちになるといいますが、
一歩間違えば大事故ですからね。[wait][clear][end]"
msg_145,"[color(yellow)]中年サラリーマン[color(white)]
ロサカンディータというブティックで、
防具の取り扱いを始めたそうなんですが、
あなた方も興味がありますか？[wait][clear][color(yellow)]中年サラリーマン[color(white)]
いや、これから防具が大流行するとしたら、
仕事に影響するものですから気になりましてね。[wait][clear][end]"
msg_146,"[color(yellow)]中年サラリーマン[color(white)]
パラベラムというバーがありまして、
そこのマスターが用心棒を雇ったそうなんですよ。
私は気が小さいから、ちょっと怖いですね。[wait][clear][end]"
