﻿msg_0,"[color(yellow)]散歩してる女性[color(white)]
最近、ＪＯＫＥＲ事件ばかり続いて、本当に嫌ね。
だんだん残虐な殺し方になってるみたいだし、
きっと愉快犯なのよ。[wait][clear][color(yellow)]散歩してる女性[color(white)]
人殺しにいいも悪いもないけど、
マスコミが取り上げてから酷くなった気がするわ。
騒ぎ過ぎるのも考え物よね。[wait][clear][end]"
msg_147,"[color(yellow)]中年サラリーマン[color(white)]
パラベラムというバーは武器の取り扱いも
しているらしいですね。
まあ、店の名前もそれっぽいですが…[wait][clear][end]"
msg_148,"[color(yellow)]中年サラリーマン[color(white)]
ギガ・マッチョは、隠しＣＤとかいって、
マンボのＣＤを隠し売りしているらしいんですが、
そんなの商売になるんでしょうかねぇ？[wait][clear][end]"
msg_149,"[color(yellow)]中年サラリーマン[color(white)]
ギガ・マッチョは、隠しＣＤとかいって、
ロックのＣＤを隠し売りしているそうなんですよ。
やっぱりロックは人気なんですね。[wait][clear][end]"
msg_150,"[color(yellow)]中年サラリーマン[color(white)]
ムー大陸がカジノを始めたんですよ！
いやぁ、恥ずかしながらバクチが大好きでして…
ぜひ行ってみようかと考えているんです。[wait][clear][color(yellow)]中年サラリーマン[color(white)]
中でもポーカーは儲かるそうですよ。
どうです？あなた方も一度行かれてみては。[wait][clear][end]"
msg_151,"[color(yellow)]中年サラリーマン[color(white)]
ムー大陸がカジノを始めたんですよ！
いやぁ、恥ずかしながらバクチが大好きでして…
ぜひ行ってみようかと考えているんです。[wait][clear][color(yellow)]中年サラリーマン[color(white)]
聞いた話ではブラックジャックの配当金が高いので
簡単に儲けられるとか。
話半分としても、一見の価値ありですよ。[wait][clear][end]"
msg_152,"[color(yellow)]中年サラリーマン[color(white)]
ムー大陸がカジノを始めたんですよ！
いやぁ、恥ずかしながらバクチが大好きでして…
ぜひ行ってみようかと考えているんです。[wait][clear][color(yellow)]中年サラリーマン[color(white)]
特にスロットはルールを覚える必要もないし、
かなり遊べる設定になってるそうですからね。
ぜひ一度行ってみてはどうですか？[wait][clear][end]"
msg_153,"[color(yellow)]中年サラリーマン[color(white)]
トニーの店ってご存じですか？
いや、不思議なアクセサリーを売ってると
評判なんですが、場所を知らないんですよ。[wait][clear][end]"
msg_154,"[color(yellow)]中年サラリーマン[color(white)]
トニーの店ってご存じですか？
いや、護身用のアイテムを売ってると
評判なんですが、場所を知らないんですよ。[wait][clear][end]"
msg_155,"[color(yellow)]中年サラリーマン[color(white)]
東亜ディフェンスが本格的に防具の扱いを
始めたらしいですね。
これからはミリタリールックかなぁ。[wait][clear][end]"
msg_156,"[color(yellow)]中年サラリーマン[color(white)]
東亜ディフェンスが武器の扱いに
力を入れることにしたそうです。
でも、店名はディフェンスなんですよね。[wait][clear][end]"
msg_157,"[color(yellow)]中年サラリーマン[color(white)]
しらいしのおかみさんが夢を実現したそうで…
いやあ、羨ましい。今度お祝いに行かないと。
ところで、どんな夢なんでしょうかね？[wait][clear][end]"
msg_158,"[color(yellow)]中年サラリーマン[color(white)]
赤提灯しらいしで、人さがしのサービスも
するそうですが、私はちょっと困りますね。
ゆっくり飲めなくなりそうですから。[wait][clear][end]"
msg_159,"[color(yellow)]中年サラリーマン[color(white)]
ＫＡＯＲＩが閉まってたって聞いてビックリです。
ついさっき行ってきたばかりなんですよ。
何があったんでしょうかね？[wait][clear][end]"
msg_160,"[color(yellow)]中年サラリーマン[color(white)]
ああ、なるほど。
買い出しで一時的に店を閉めていたんですね。
安心しました。[wait][clear][end]"
msg_161,"[color(yellow)]中年サラリーマン[color(white)]
ああ、風邪ですか…
じゃあ、あの時はかなり無理をしてたのかな？
何だか悪いことをしましたねぇ。[wait][clear][end]"
msg_162,"[color(yellow)]中年サラリーマン[color(white)]
ＫＡＯＲＩが海外から新商品を
入荷したらしいですね。
商売が好調でうらやましいなあ。。[wait][clear][end]"
msg_163,"[color(yellow)]中年サラリーマン[color(white)]
ＫＡＯＲＩの店主の香さん、風邪だそうですね。
つい先日、店に行ったばかりだったんですが、
無理をさせてしまったみたいで…[wait][clear][color(yellow)]中年サラリーマン[color(white)]
なんにせよ、早く元気になって欲しいですね。[wait][clear][end]"
msg_164,"[color(yellow)]中年サラリーマン[color(white)]
時間城では魔法のカードの複製も
してくれるそうですよ。
至れり尽くせりですね。[wait][clear][end]"
msg_165,"[color(yellow)]中年サラリーマン[color(white)]
時間城で魔法のカードを売っているそうです。
ははは、いかにも子供たちが好きそうな話ですね。
ところで、どんなカードなんでしょうかねぇ？[wait][clear][end]"
msg_166,"[color(yellow)]若い男[color(white)]
俺、最近引っ越してきたんだけど、
ホント青葉区っていいとこだよね。[wait][clear][color(yellow)]若い男[color(white)]
緑が豊富で落ち着いたふんいきだし、
キスメット出版や珠閒瑠テレビなんかもあって、
まさに情報発信基地って感じじゃん。[wait][clear][color(yellow)]若い男[color(white)]
その上、野外音楽堂まであるから青葉通りで
買い物中に、芸能人を見かけたりとかするし、
これで家賃が安けりゃいうことないんだけどね。[wait][clear][end]"
msg_167,"[color(yellow)]若い男[color(white)]
何でかはわかんないんだけどさ、ＪＯＫＥＲは
七姉妹学園の紋章が苦手らしいぜ。
今けっこう話題になってんだよ。[wait][clear][color(yellow)]若い男[color(white)]
最近は事件続きで、マスコミでも情報が遅れる事が
あるからさ、こういう時は噂に敏感でないとね。[wait][clear][end]"
msg_168,"[color(yellow)]若い男[color(white)]
ニュース見た？
空の科学館が全焼だってよ！
まったくビックリだね。[wait][clear][end]"
msg_169,"[color(yellow)]若い男[color(white)]
やっぱりさ、ここまで治安が悪くなったら、
警察には任せてらんないよ。[wait][clear][color(yellow)]若い男[color(white)]
どうせだから自衛隊を使って、
ぱーっとＪＯＫＥＲ退治ってのがいいと思うな。[wait][clear][end]"
msg_170,"[color(yellow)]若い男[color(white)]
なんかさ、警察が今回の事件をわざと
解決しないようにしているって聞いたんだけど、
ホントなのかな？[wait][clear][color(yellow)]若い男[color(white)]
まあ、不祥事とかあちこちで起こったりしたし、
あまり信用したら危ないとは思ってたけどさ、
ちょっとショックだよね。[wait][clear][end]"
msg_171,"[color(yellow)]若い男[color(white)]
なんか、黒塗りの車が何台も走っていくのを
見たんだけど、アレが噂のＪＯＫＥＲ狩りの
連中なのかな？[wait][clear][color(yellow)]若い男[color(white)]
何が目的だかわかんないけど、
絶対まともじゃねェよ。
なんか悪い事企んでるとみたね。[wait][clear][end]"
msg_172,"[color(yellow)]若い男[color(white)]
事件の鍵を握る重要人物のハナシが
すごく話題になってるんだけどさ、
男だって以外、全然情報が無いんだよ。[wait][clear][color(yellow)]若い男[color(white)]
っていうか、すげー気になるんだけど、
一体どんな奴なんだろ。[wait][clear][end]"
msg_173,"[color(yellow)]若い男[color(white)]
事件の鍵を握る重要人物のハナシが
すごく話題になってるんだけどさ、
女だって以外、全然情報が無いんだよ。[wait][clear][color(yellow)]若い男[color(white)]
っていうか、すげー気になるんだけど。
ちょっと見に行ってみようかな？[wait][clear][end]"
msg_174,"[color(yellow)]若い男[color(white)]
例の重要人物、結局逃げられたんだってさ。
なんか、すげーがっくし。
こんな事なら、見に行っとけばよかったよ。[wait][clear][end]"
msg_175,"[color(yellow)]若い男[color(white)]
レッツ・ポジティブシンキング！
さあみんな、講演会に行ってみよう！
きっと人生かわって良くなるよ。[wait][clear][end]"
msg_176,"[color(yellow)]若い男[color(white)]
レッツ・ポジティブシンキング！
大丈夫、大丈夫、新世塾は穢れを祓うよ。
やり方が強引なのは、ま、ご愛敬さ！[wait][clear][end]"
msg_177,"[color(yellow)]若い男[color(white)]
レッツ・ポジティブシンキング！
みんな地震がおこったから、わかっただろ？
やっぱり世界を浄化しないと！[wait][clear][end]"
msg_178,"[color(yellow)]若い男[color(white)]
レッツ・ポジティブシンキング！
街が飛んでるなんて素晴らしい！
これぞ世界再生の第一歩だ！[wait][clear][end]"
msg_179,"[color(yellow)]若い男[color(white)]
レッツ・ポジティブシンキング！
きっと、生け贄が足りないからこうなったんだ。[wait][clear][color(yellow)]若い男[color(white)]
この街の穢れた連中を生け贄に差し出せば、
穢れ払いをした人間は助かるに違いない！[wait][clear][end]"
msg_180,"[color(yellow)]若い男[color(white)]
クラブゾディアックの中が迷路に
なったらしいんだけど気づかなかったな。
すげースピードで改装したんだね。[wait][clear][end]"
msg_181,"[color(yellow)]若い男[color(white)]
そこの青葉公園の花がさ、話すらしいんだよ。
いや、マジ、しゃれじゃなくってさ。
なんなら見てきたらいいんじゃないかな。[wait][clear][end]"
msg_182,"[color(yellow)]若い男[color(white)]
ファンタジーワールドって雑誌が話題だけどさ、
俺はやっぱり珠閒瑠ウォーカーだね。
やっぱ流行にこだわらないと。[wait][clear][end]"
msg_183,"[color(yellow)]若い男[color(white)]
別冊ミラクルがねぇ…話題にゃなってるんだけど、
俺は懸賞より中身が気になるな。[wait][clear][color(yellow)]若い男[color(white)]
やっぱり、ボバイでいいや。[wait][clear][end]"
msg_184,"[color(yellow)]若い男[color(white)]
月刊バトルマスターで、本物のアクセサリーを
プレゼントする企画を始めたんだってさ。
昔読んでた本なんだけど、懐かしいね。[wait][clear][end]"
msg_185,"[color(yellow)]若い男[color(white)]
月刊バトルマスターで、本物の防具を
プレゼントする企画を始めたんだってさ。
昔読んでた本なんだけど、懐かしいね。[wait][clear][end]"
msg_186,"[color(yellow)]若い男[color(white)]
月刊バトルマスターで、本物の武器を
プレゼントする企画を始めたんだってさ。
昔読んでた本なんだけど、懐かしいね。[wait][clear][end]"
msg_187,"[color(yellow)]若い男[color(white)]
珠閒瑠ジニーで相性占いが
受けられるんだってさ。[wait][clear][color(yellow)]若い男[color(white)]
って言っても相手がいないんだよな。
あーあ。夢崎区にナンパにでもいこうかな。[wait][clear][end]"
msg_188,"[color(yellow)]若い男[color(white)]
珠閒瑠ジニーの占い、ハズレてばかり
だったんだけど、ワンロン占いを始めて
変わったらしいよ。[wait][clear][color(yellow)]若い男[color(white)]
そっかー
ワンロンって当たるんだなー
やっぱワンロン千鶴ってすげーよ。[wait][clear][end]"
msg_189,"[color(yellow)]若い男[color(white)]
パラベラムってバーでさ、
武器の売買やってるらしいぜ。
けっこう怖いとこだったんだな。[wait][clear][end]"
msg_190,"[color(yellow)]若い男[color(white)]
ムー大陸がカジノ始めたんだよ。
遊びにいくのはいいんだけど、
ついつい無駄に時間食っちゃうんだよね。[wait][clear][end]"
msg_191,"[color(yellow)]のんきなおじいさん[color(white)]
[color(orange)]青葉公園の花は話をする[color(white)]んじゃよ。
管理人さんが時々話しこんどるのを見るんじゃ。
耳が遠いから話しとる声は聞こえんがの。[wait][clear][end]"
msg_192,"[color(yellow)]のんきなおじいさん[color(white)]
耳が遠いとつらいのお。
花と昔話を一日中語りあいたいんじゃが…[wait][clear][end]"
msg_193,"[color(yellow)]パオフゥ[color(white)]
須藤の息子は、蝸牛山（かたつむりやま）の
病院に入院してるはずだぜ…[wait][clear][end]"
msg_194,"[color(yellow)]克哉[color(white)]
そうか。
天野君、早速行ってみよう。[wait][clear][end]"
msg_195,"[color(yellow)]パオフゥ[color(white)]
ちょいと待ちな。
この通りに、ベルベットルームってぇ店がある。[wait][clear][end]"
msg_196,"[color(yellow)]パオフゥ[color(white)]
悪魔だかなんだか知らねぇが、
お前さん、命狙われてんだろう？
これから絶対必要になる。先に寄っとこうや。[wait][clear][end]"
msg_197,"[color(yellow)]克哉[color(white)]
なんだそれは…？
何の関係があるんだ？[wait][clear][end]"
msg_198,"[color(yellow)]パオフゥ[color(white)]
説明すんのも面倒臭ぇ…
いいから付いて来な。[wait][clear][end]"
msg_199,"[color(yellow)]うらら[color(white)]
公園でのんびりするのもいいけどさ、
今はそんな事してる場合じゃないと思うよ。[wait][clear][end]"
msg_200,[color(green)]ここには用は無い。[color(white)][wait][clear][end]
msg_201,"[color(yellow)]パオフゥ[color(white)]
こんなところでお昼寝している場合じゃねぇだろ。
先を急ぐぜ。[wait][clear][end]"
msg_202,"[color(yellow)]克哉[color(white)]
またここには来ることになりそうだが、
今は用がないな。
先を急ごう。[wait][clear][end]"
msg_203,"[color(yellow)]うらら[color(white)]
残念だけど、ゆっくりするのは
事件が片づいてからだね。
さ、いこ。[wait][clear][end]"
msg_204,"[color(yellow)]克哉[color(white)]
テレビ局で情報を集めるのか？
やめておいたほうがいい。
受付より奥には行かせてくれないはずだ。[wait][clear][end]"
msg_205,"[color(yellow)]パオフゥ[color(white)]
テレビ局？
やめとけ、どうせ中に入れねぇし、
番組で流してる以外の情報も無えさ。[wait][clear][end]"
msg_206,"[color(yellow)]克哉[color(white)]
いくらなんでもこんな目立つところに
詐欺師はいないだろう。
ほかを捜そう。[wait][clear][end]"
msg_207,"[color(yellow)]パオフゥ[color(white)]
おいおい、こんなところで油を売ってる
場合じゃないぜ。
ＧＯＬＤへ行こうや。[wait][clear][end]"
msg_208,"[color(yellow)]うらら[color(white)]
テレビ局ねぇ…
ちょっと興味あるんだけど、
今はそれどころじゃないし。[wait][clear][color(yellow)]うらら[color(white)]
ま、今度暇なときに来ようか。[wait][clear][end]"
msg_209,[color(green)]ここには用は無い。[color(white)][wait][clear][end]
msg_210,"[color(yellow)]パオフゥ[color(white)]
おい、まだ用は済んでねぇぜ？
いいからベルベットって店に行ってみな。
[sync][wait][clear][end]"
